-2.102378,54.975248,Aldi,"5 Haugh Lane Industrial Estate, Hexham, Northumberland, NE46 3PU"
-1.537755,55.130684,Aldi,"Cowpen Road, Blyth, Northumberland, NE24 5EZ"
-1.580725,55.087472,Aldi,"East West Link Road, Cramlington, Northumberland, NE23 1DA"
-1.587204,55.185415,Aldi,"Morpeth Road, Ashington, Northumberland, NE63 8QG"
-2.010898,55.781388,Aldi,"North Road, Berwick-Upon-Tweed, Northumberland, TD15 1QQ"
-1.693259,55.406148,Aldi,"South Road, Alnwick, Northumberland, NE66 2PA"
-2.716722,52.735414,Aldi,"Aldi Foodstore Ltd, Arlington Way, Shrewsbury, Shropshire, SY1 4NP"
-2.717848,52.371419,Aldi,"Station Drive, Ludlow, Shropshire, SY8 2PQ"
-2.407047,52.529353,"Aldi Stores","Aldi Stores Ltd, Food Store, Kings Court, Stourbridge Road, WV15 6AL"
-3.052378,52.86035,"Aldi Stores Ltd","Aldi Foodstore Ltd, Oswald Road, Oswestry, Shropshire, SY11 1RB"
-3.043069,52.852468,"Aldi Stores Ltd","Shrewsbury Road, Oswestry, Shropshire, SY11 2RT"
0.610345,50.874804,ALDI,"Rye Road, Hastings, East Sussex, TN35 5DG"
-2.534351,51.478166,Aldi,"670-680 Fishponds Road, Fishponds, Bristol, BS16 3HJ"
-2.552617,51.459702,Aldi,"273-279 Church Road, Redfield, Bristol, BS5 9HT"
-2.602935,51.503278,Aldi,"155 Greystoke Avenue, Southmead, Bristol, BS10 6AS"
-2.61253,51.441924,Aldi,"Aldi Foodstore Ltd, North Street, Bedminster, Bristol, BS3 1JA"
-1.256146,53.123587,Aldi,"Station Road, NG17 5FF"
-1.206162,53.032526,Aldi,"Aldi Foodstore Ltd, Ashgate Road, NG15 7LZ"
-1.24981,53.100418,"Aldi Stores Limited","Aldi, Urban Road, NG17 8DA"
-3.376799,51.741271,"Aldi Store","Plymouth Street, Merthyr Tydfil, CF47 0TP"
-1.933167,53.325124,Aldi,"Foresters Way, Chapel-en-le-frith, SK23 0RB"
-1.31675,53.324522,Aldi,"7 Parkside Shopping Centre, Killamarsh, Sheffield, S21 1FY"
-1.4757,53.305946,Aldi,"Aldi Foodstore Ltd, Sheffield Road, Dronfield, S18 2GG"
-0.059676,53.572831,Aldi,"361 Cleethorpe Road, Grimsby, DN31 3BP"
-0.211019,53.617351,"Aldi Stores Limited","Washdyke Lane, Immingham, DN40 2AA"
-0.117076,53.558052,"Aldi Stores Ltd","Magdalene Road, Grimsby, DN34 5DN"
0.851007,52.830071,"Aldi Stores Ltd","Aldi Foodstore Ltd, Norwich Road, Fakenham, Norfolk, NR21 8AX"
-0.196263,51.540819,Aldi,"142-162      Kilburn High Road, NW6 4JD"
-3.181589,53.375798,Aldi,"4 Bridge Road, West Kirby, Wirral, Merseyside, CH48 5EX"
-3.097374,53.3294,Aldi,"9 May Road, Heswall, Wirral, Merseyside, CH60 5RA"
-3.000935,53.358528,"Aldi Stores Ltd","144 Bebington Road, Port Sunlight, Wirral, Merseyside, CH62 5BJ"
-3.101296,53.403488,"Aldi Stores Ltd","17-21 Hoylake Road, Moreton, Wirral, Merseyside, CH46 9PD"
-3.049594,53.373409,"Aldi Stores Ltd","360 Woodchurch Road, Prenton, Wirral, Merseyside, CH42 8PG"
-3.046444,53.398184,"Aldi Stores Ltd","Laird Street, Birkenhead, Wirral, Merseyside, CH41 8DB"
-3.07247,53.412218,"Aldi Stores Ltd","Unit 2A Junction One Retail Park, Bidston Moss, Leasowe, Wirral, CH44 2HE"
-1.320222,51.406813,"Aldi Foodstore Ltd","London Road, Newbury, West Berkshire, RG14 1LA"
-1.023982,51.443818,"Aldi Stores Limited","Bath Road, Calcot, Reading, Berkshire, RG30 2HB"
-2.084367,57.152866,"ALDI STORES LIMITED","UNIT 9-10 Boulevard Retail Park, Links Road, Aberdeen, AB24 5EZ"
-2.947068,54.889292,"Aldi Stores Limited","Dalston Road, Carlisle, CA2 5NP"
-2.942293,54.914474,"Aldi Stores Ltd","Aldi Ltd, Kingstown Road, Carlisle, CA3 0AJ"
-2.906635,54.876444,"Aldi Stores Ltd","Aldi Stores Limited, Petteril Bank Road, Carlisle, CA1 3AG"
1.30091,51.13535,"Aldi Foodstore Ltd","Cherry Tree Avenue, Dover, Kent, CT16 2NL"
-3.590726,54.543578,"Aldi Stores Ltd","Aldi Foodstore Ltd, Preston Street, Whitehaven, Cumbria, CA28 9DL"
-3.442676,56.396235,"Aldi Stores Limited","Aldi, 21 Glasgow Road, Perth, PH2 0NZ"
-3.481167,56.417391,"Aldi Stores Ltd","Unit 6-7A, Ruthvenfield Road, Inveralmond Industrial Estate, Perth, PH1 3EE"
-0.241248,51.763609,Aldi,"11 Parkhouse Court, Hatfield, Hertfordshire, AL10 9RQ"
-1.287261,51.751639,Aldi,"Botley Road, Oxford, Oxfordshire, OX2 0HA"
-4.290344,53.268841,"Aldi Stores","Aldi, Lon Y Felin, Llangefni, Isle Of Anglesey, LL77 7SA"
-0.964178,52.950533,"Aldi Stores Ltd","64 - 74 Nottingham Road, Bingham, Nottinghamshire, NG13 8AW"
-0.551033,53.206696,Aldi,"233 Newark Road, Lincoln, Lincolnshire, LN5 8NT"
-0.514039,53.241147,Aldi,"260-266 Wragby Road, Lincoln, LN2 4PX"
0.24852,51.556482,Aldi,"119-129 St Mary's Lane, Upminster, RM14 2QB"
0.162554,51.582343,Aldi,"7 Marlborough Road, Romford, RM7 8AD"
0.161492,51.598603,Aldi,"89-97 Collier Row Road, Romford, RM5 3NR"
0.182292,51.580071,"Aldi Stores Ltd","45 Market Place, Romford, RM1 3AB"
-0.136445,50.830186,Aldi,"1-4 London Road, Brighton, Brighton & Hove, BN1 4JA"
-1.394736,53.375082,Aldi,"The Turner Business Park, Richmond Park Road, Sheffield, S13 8HT"
-1.412404,53.405193,"Aldi Stores Limited","Meadowhall Retail Park, Attercliffe Common, Sheffield, S9 2YZ"
-1.474388,53.372466,"Aldi Stores Limited","St Mary's Gate, Sheffield, S2 4QA"
-1.461535,53.444138,"Aldi Stores Ltd","82 The Common, Sheffield, S35 9WN"
0.6805,51.54531,"Aldi Stores Ltd","Aldi, 666 - 686 London Road, Westcliff-On-Sea, Essex, SS0 9HQ"
0.710581,51.554404,"Aldi Stores Ltd","Aldi, 1 - 3 Eastern Avenue, Southend-On-Sea, Essex, SS2 5YB"
-2.236586,53.085155,ALDI,"Liverpool Road, Kidsgrove, Staffordshire"
-2.227829,53.008427,"ALDI STORES LTD","Blackfriars Road, Newcastle under Lyme, Staffordshire, ST5 3HY"
-1.93485,52.546901,"Aldi Stores Limited","2a Birmingham Road, Great Barr, B43 6NR"
-2.021222,52.490784,"Aldi Stores Ltd","Wolverhampton Road, Oldbury, B69 4RJ"
-2.74144,52.22588,"Aldi Stores Ltd","Westbury Street, Leominster, HR6 8NY"
-2.722408,52.057091,"Aldi Supermarket","166-168 Eign Street, Hereford, HR4 0AP"
-2.581603,51.916444,"Aldi Supermarket","Brookend Street, Ross-On-Wye, HR9 7EE"
0.754383,52.415815,"Aldi Stores Limited","Aldi Foodstore Ltd, Lime Kiln Lane, Thetford, Norfolk, IP24 2BU"
-1.952759,51.70592,Aldi,"Cricklade Road, Cirencester, Gloucestershire, GL7 1NP"
-3.983261,55.868257,Aldi,"20 High Street, Airdrie, Lanarkshire, ML6 0DT"
-4.009557,55.820379,"Aldi Foodstore Ltd","14 Unthank Road, Bellshill, Lanarkshire, ML4 1DD"
-3.933927,55.775382,"Aldi Gmbh & Co Kg","109 Glasgow Road, Wishaw, Lanarkshire, ML2 7QH"
-3.99281,55.789117,"Aldi Stores Limited","Mason Street, Motherwell, ML1 1YE"
-3.983048,55.865016,"Aldi Stores Ltd","6 Manse Place, Airdrie, Lanarkshire, ML6 0AN"
-4.198994,55.897834,ALDI,"380 Hillhead Road, Glasgow, G21 3PE"
-4.240639,55.859129,"Aldi Stores","132 High Street, Glasgow, G1 1PQ"
-4.334663,55.89423,"Aldi Stores Limited","4 Knightscliffe Avenue, Glasgow, G13 2TG"
1.12721,52.078527,"Aldi Stores Limited","14 Meredith Road, Ipswich, Suffolk, IP1 6EB"
1.1837,52.047756,"Aldi Stores Limited","3 Hines Road, Ipswich, Suffolk, IP3 9BG"
-1.933814,52.647811,Aldi,"Aldi Food Stores Limited, High Street, Brownhills, Walsall, WS8 6ED"
-2.052176,52.562207,Aldi,"Burns Road, Bilston, Walsall, West Midlands, WS10 8SR"
-0.736245,52.404509,"Aldi Food Stores","Stanier Retail Park, Kettering, Northamptonshire, NN16 9XW"
-0.71914,52.374863,"Aldi Stores GMBH","Unit 7 Aldi  Food Store, Carina Road, Kettering, Northamptonshire, NN15 6YA"
-0.408631,53.84513,"Aldi Stores Ltd","Swinemoor Lane, Beverley, East Riding Of Yorkshire, HU17 0JX"
0.032368,53.730486,"Aldi Stores Ltd.","134 Queen Street, Withernsea, East Riding Of Yorkshire, HU19 2HB"
-0.211551,54.079458,"Aldi Stores Ltd.","Bessingby Way, Bridlington, East Riding Of Yorkshire, YO16 4SJ"
-0.450692,53.76229,"Aldi Stores Ltd.","Great Gutter Lane East, Willerby, Hull, HU10 6DE"
-0.779513,53.928304,"Aldi Stores Ltd.","Robertson Close, Pocklington, York, YO42 2QT"
-4.307527,51.849947,"Aldi GMBH","Stephens Way, Myrtle Hill, Pensarn, Carmarthen, Carmarthenshire, SA31 2BG"
-4.084566,51.796731,"ALDI STORES LIMITED","Llandeilo Road, Meadows Road, Cross Hands, Llanelli, Carmarthenshire, SA14 6RD"
-4.158208,51.68455,"ALDI STORES LTD","Millbrook House, Swanfield Place, Llanelli, Carmarthenshire, SA15 3PW"
-4.196124,55.764315,Aldi,"3-4 Queensway, East Kilbride, Glasgow, G74 1HE"
-3.834264,55.729334,"Aldi Stores Ltd","Kirkton Street, Carluke, ML8 4JP"
-4.064662,55.773668,"Aldi Stores Ltd","70 Wellhall Road, Hamilton, Lanarkshire, ML3 9BY"
-4.2191,55.826374,"Aldi Stores Ltd","Unit 2e, 5 Harriet Street, Rutherglen, Glasgow, G73 2EZ"
-4.650967,52.08851,"Aldi Stores","Aldi Foodstores Ltd Aberystwyth Road, Cardigan, Ceredigion, SA43 1LU"
-1.069778,53.416904,Aldi,"Aldi Stores Ltd, Scrooby Road, Harworth, Nottinghamshire, DN11 8JT"
-1.125697,53.310826,"Aldi Foodstore Ltd","Gateford Road, Worksop, Nottinghamshire, S80 1UD"
-0.941371,53.31994,"Aldi Foodstores Ltd","Aldi Stores Limited 89-105, Carolgate, Retford, Nottinghamshire, DN22 6EH"
0.355778,51.442151,"Aldi Food Store Ltd","100-102 London Road, Gravesend, Kent, DA11 9LY"
-1.932773,52.681315,Aldi,"Bridge Cross Road, Burntwood, WS7 2BX"
-1.819115,52.684316,Aldi,"Church Street, Lichfield, WS13 6EB"
-4.617104,55.486399,"Aldi Stores Limited","135 - 147 Ayr Road Prestwick South Ayrshire, KA9 1TW"
-4.630579,55.466981,"Aldi Stores Limited","33 Main Street Ayr South Ayrshire, KA8 8BU"
-4.577575,55.9864,"ALDI GMBH & Co. KG","Aldi Store, 81 Bank Street, Alexandria, G83 0LZ"
-4.400896,55.902483,"ALDI GMBH & Co. KG","Unit 6, K Retail Park, Argyll Road, Clydebank, G81 1QA"
0.016505,50.878492,"Aldi Stores Limited","Aldi House, Brooks Road, Lewes, BN7 2BY"
-3.041154,53.876659,ALDI,"Crescent West, Thornton Cleveleys, Lancashire, FY5 1AD"
-3.028644,53.918527,"ALDI STORES LIMITED","Poulton Road, Fleetwood, Lancashire, FY7 7DA"
-2.781064,53.900331,"ALDI STORES LTD","Moss Lane, Garstang, Lancashire, PR3 1HB"
-0.427413,52.15265,Aldi,"147 Church Lane, Bedford, MK41 0PW"
-2.549528,53.596656,"Aldi Stores Ltd","Mason Street, Horwich, Bolton, BL6 5QH"
-2.429898,53.585578,"Aldi Stores Ltd","Higher Bridge Street, Bolton, BL1 2HJ"
-2.431592,53.57244,"Aldi Stores Ltd","Trinity Street, Bolton, BL3 6DH"
-2.382332,53.582468,"Aldi Stores Ltd (Bolton)","Breightmet Fold Lane, Bolton, BL2 6PP"
-3.904543,51.661008,Aldi,"96 Samlet Road, Swansea Enterprise Park, Swansea, SA7 9AF"
-4.037553,51.666167,Aldi,"Aldi, Millers Drive, Gorseinon, Swansea, SA4 4QN"
-3.965796,51.635377,Aldi,"Aldi Foodstore Ltd, Parc Cwmdu, Carmarthen Road, Cwmdu, Swansea, SA5 8LJ"
-1.945463,52.094132,Aldi,"4 Swan Lane, Evesham, Worcestershire, WR11 4PA"
-2.158055,52.272562,Aldi,"Unit 2, Roman Way Retail Park, Kidderminster Road, Droitwich Spa, WR9 9AT"
-2.012472,53.944226,"Aldi Stores Ltd","Keighley Road, Skipton, BD23 2TA"
-3.376366,51.533258,"Aldi Stores Limited","Unit 3, Glamorgan Vale Retail Park, Talbot Green, Pontyclun, CF72 8RP"
-3.290256,51.578828,"Aldi Stores Ltd","Unit 2, Midway Retail Park, Upper Boat, Pontypridd, CF37 5BL"
0.156497,52.66811,"Aldi Stores Limited","North End, Wisbech, Cambridgeshire, PE13 1NX"
-1.54413,53.74889,Aldi,"Middleton Park Road, Middleton, Leeds, LS10 3SA"
-1.627029,53.805783,Aldi,"Stanningley Road, Leeds, LS13 3AD"
-1.543169,53.775949,Aldi,"Unit 1 Tunstall Road Retail Park, Tunstall Road, Beeston, Leeds, LS11 5JF"
-1.581863,53.772855,"Aldi (Beeston)","Unit 2 Junction 1 Retail Park, Ring Road Beeston, Beeston, Leeds, LS11 0BD"
-1.564124,53.828742,"Aldi (Meanwood)","Unit 1 Northside Retail Park, Stonegate Road, Meanwood, Leeds, LS7 2TT"
-1.456341,53.814919,"Aldi (Seacroft)","York Road, Leeds, LS14 6HP"
-1.583799,53.805758,"Aldi Store","Evanston Avenue, Burley, Leeds, LS4 2HR"
-1.496603,50.988586,"Aldi Stores","35 The Hundred, Romsey, Hampshire, SO51 8GE"
1.727453,52.493968,"Aldi Stores Ltd","Aldi Store, Millennium Way, Lowestoft, Suffolk, NR32 4GG"
-0.752073,51.392044,Aldi,"Aldi, 136 Liscombe, Bracknell, RG12 7DE"
-2.633834,53.487217,Aldi,"5 Princess Road, Ashton-In-Makerfield, Wigan, WN4 9DA"
-2.519731,53.494464,Aldi,"62 King Street, Leigh, WN7 4LJ"
-2.551418,53.524812,Aldi,"641 Atherton Road, Hindley Green, Wigan, WN2 4SQ"
-2.471391,53.514799,"Aldi Foodstore Ltd","Castle Street, Tyldesley, Manchester, M29 8EW"
-2.665834,53.585602,"Aldi Stores Ltd","School Lane, Standish, Wigan, WN6 0TG"
-2.652498,53.540599,"Aldi Stores ltd","Scot Lane, Newtown, Wigan, WN5 0TQ"
-0.138706,51.320014,"Aldi Stores Limited","159 Brighton Road Coulsdon CR5 2NH, CR5 2NH"
-0.057667,51.345739,"Aldi Stores Limited","Aldi Foodstore Limited 232 - 236 Addington Road South Croydon CR2 8LE, CR2 8LE"
0.419297,52.754059,"Aldi Stores Limited","Queen Mary Road, Gaywood, King's Lynn, PE30 4QF"
-0.638397,53.566426,Aldi,"Ashby High Street, Scunthorpe, North Lincolnshire, DN16 2JU"
-0.645811,53.594781,Aldi,"Glebe Road, Scunthorpe, North Lincolnshire, DN15 6AF"
-0.957009,51.157374,"Aldi Stores Ltd","Unit, 1 Alton Retail Park, Mill Lane, Alton, GU34 2QS, GU34 2QS"
-3.817263,53.318941,Aldi,"Aldi Foodstore Ltd, Mostyn Champneys Retail Park, Llandudno, LL30 1RY"
-4.448532,55.903881,Aldi,"1a Bridgewater Shopping Centre, Bridgewater Place, Erskine, Renfrewshire, PA8 7AA"
-4.385364,55.87778,"Aldi Stores Ltd","44-46 High Street, Renfrew, Renfrewshire, PA4 8QP"
-4.463365,55.837551,"Aldi Stores Ltd","Unit A, 4 Fulbar Road, Paisley, Renfrewshire, PA2 9AP"
-1.142376,51.89873,Aldi,"ALDI, Launton Road, Bicester, OX26 6PZ"
-2.448658,52.715327,"Aldi Foodstore Limited","Wellington Road, Donnington, Telford, Shropshire, TF2 8JS"
-2.365572,52.763806,"Aldi Stores Ltd","Audley Avenue, Newport, Shropshire, TF10 7DW"
-2.520851,52.700181,"Aldi Supermarket","Bridge Road, Wellington, Telford, Shropshire, TF1 1DZ"
-2.761501,54.65759,"Aldi Stores Ltd","Ullswater Road, Penrith, CA11 7EH"
-3.20973,54.114085,Aldi,"148 Risedale Road, Barrow-In-Furness, Cumbria, LA13 9RA"
-3.235049,54.114116,"Aldi Food Stores Limited","Aldi Foodstore Ltd, Hindpool R, Hindpool Road, Barrow-In-Furness, Cumbria, LA14 2PD"
-3.57993,50.41585,"Aldi Stores Limited","Brixham Road, Paignton, TQ4 7BD"
-2.969031,53.483342,"Aldi Foodstore Ltd","Aldi, Park Lane West, Netherton, Sefton Council, L30 6UH"
-2.968957,53.635314,"Aldi Store","Meols Cop Retail Park, Foul Lane, Southport, Merseyside, PR9 7RG"
-3.000917,53.448283,"Aldi Stores Ltd","Leaders Autos, Washington Parade, Bootle, Merseyside, L20 5HH"
0.255169,52.013702,"Aldi Stores Ltd","Aldi Foodstore Ltd, Thaxted Road, Saffron Walden, Essex, CB10 2UQ"
-0.412816,51.442902,"Aldi Stores Ltd","76-86 High Street, Feltham, TW13 4EX"
-0.371109,51.467742,"Aldi Stores Ltd","Aldi Store, Hospital Road, Hounslow, TW3 3HY"
-1.526923,54.522678,Aldi,"255 Yarm Road, Darlington, DL1 1BA"
-0.474619,51.514527,"Aldi Stores Ltd","143-161 High Street, Yiewsley, UB7 7QN"
0.002279,53.372159,"Aldi Stores Limited","Aldi Supermarket, Newbridge Hill, Louth, LN11 0JT"
-0.054328,51.478372,"Aldi stores limited","840, Old Kent Road, London, SE15 1NQ"
-1.203,52.779756,Aldi,"51 Belton Road, Loughborough, LE11 1JA"
-1.074033,52.697947,Aldi,"1169 Melton Road, Syston, LE7 2JT"
-0.809004,51.819286,Aldi,"143 Cambridge Street, Aylesbury, Buckinghamshire, HP20 1BT"
-0.83228,51.823034,Aldi,"4 Rimmington Way, Aylesbury, Buckinghamshire, HP19 8AW"
-0.991495,51.989153,Aldi,"Unit 3, Osier Way, Buckingham, Buckinghamshire, MK18 1TB"
-2.937379,53.394883,Aldi,"281 Smithdown Road, LIVERPOOL, Merseyside, L15 2HF"
-2.887085,53.419969,Aldi,"367 East Prescot Road, LIVERPOOL, Merseyside, L14 2DE"
-2.926216,53.441793,Aldi,"40 Lorenzo Drive, LIVERPOOL, Merseyside, L11 1BQ"
-2.980117,53.406621,Aldi,"74-75 Saint Johns Way, St Johns Precinct, LIVERPOOL, Merseyside, L1 1LS"
-2.872577,53.390449,Aldi,"Supermarket, Gateacre Park Drive, LIVERPOOL, Merseyside, L25 1PD"
-2.971922,53.43645,"Aldi Foodstore Ltd","2 Salop Street, LIVERPOOL, Merseyside, L4 4BZ"
-2.064098,52.311955,Aldi,"Sherwood Road, Bromsgrove, Worcestershire, B60 3AR"
-2.766011,54.131102,Aldi,"Scotland Road, Carnforth, Lancashire, LA5 9JZ"
-2.872035,54.07205,Aldi,"Marine Road West, Morecambe, Lancashire, LA4 4BU"
-2.820631,54.056799,"Aldi Stores Ltd","Morecambe Road, Lancaster, Lancashire, LA1 5JB"
-1.938099,53.911001,Aldi,"Keighley Road, Silsden, BD20 0EA"
-1.902887,53.865958,Aldi,"Gresley Road, Keighley, BD21 5JG"
-1.819109,53.803601,Aldi,"247 Allerton Road, Bradford, BD15 7QU"
-1.75222,53.801837,Aldi,"50 Valley Road, Bradford, BD1 4RX"
-1.771367,53.835113,Aldi,"4 Tony Miller Approach, Shipley, BD17 7TS"
-1.77468,51.086145,Aldi,"Aldi Stores Ltd, London Road, Salisbury, Wiltshire, SP1 3HP"
-2.143179,51.381918,Aldi,"Beanacre Road, Melksham, Wiltshire, SN12 8RP"
-2.213012,51.310642,Aldi,"Bradley Road, Trowbridge, Wiltshire, BA14 0QT"
-1.780886,51.171833,Aldi,"Salisbury Street, Amesbury, Salisbury, Wiltshire, SP4 7HD"
-2.185325,51.257916,"ALDI Stores Limited","60-62 Warminster Road, Westbury, Wiltshire, BA13 3PF"
-1.682234,54.642359,"Aldi Stores Ltd","149 Watling Road, Bishop Auckland, DL14 9AU"
-1.601395,54.698099,"Aldi Stores Ltd","Cambridge Street, Spennymoor, DL16 6DF"
-1.540762,54.776113,"Aldi Stores Ltd","Unit 8 Dragonville Retail Park, Dragon Lane, Durham, DH1 2WP"
-1.335451,54.759625,"Aldi Stores Ltd","Bede Way, Peterlee, SR8 1BU"
-1.835904,54.848259,"Aldi Stores Ltd","Front Street, Consett, DH8 5RE"
-1.334237,54.83835,"Aldi Stores Ltd","North Railway Street, Seaham, SR7 7DA"
-1.569715,54.621432,"Aldi Stores Ltd","Greenwell Road, Newton Aycliffe, DL5 4DH"
-1.572991,54.860012,"Aldi Stores Ltd","Picktree Lane, Chester-Le-Street, DH3 3SN"
-1.553769,52.770751,"Aldi Stores Limited","Coppice Side, Swadlincote, Derbyshire, DE11 9AA"
-1.629499,52.871586,"Aldi Stores Ltd","Huntspill Road, Hilton, Derby, DE65 5JR"
-1.268936,52.897782,Aldi,"Cross Street, Long Eaton, NG10 1HD"
-1.318314,52.988159,Aldi,"Manor Road, Ilkeston, DE7 8TG"
-2.971859,53.167425,"Aldi Broughton","Broughton Shopping Park, Chester Road, Broughton, CH4 0DP"
-3.131198,53.247974,"Aldi Flint","55-57 Chester Street, Flint, CH6 5DH"
-3.141544,53.168167,"Aldi Mold","King Street, Mold, CH7 1LA"
-0.012551,51.760692,Aldi,"Aldi Stores Limited, Taverners Way, Hoddesdon, Hertfordshire, EN11 8TY"
