-1.933972,52.304556,Aldi,"1 Trafford Park, Trescott Road, Redditch, Worcestershire, B98 7AH"
-2.255323,53.482965,"Aldi Stores Ltd","Aldi Foodstore Ltd, Sisson Street, Failsworth, Oldham, M35 0AT"
-2.128033,53.547588,"Aldi Stores Ltd","Aldi Stores Limited, Ellen Street, Oldham, OL9 6QR"
-2.094166,53.574602,"Aldi Stores Ltd.","1 Refuge Street, Shaw, Oldham, OL2 8RH"
-1.894911,52.276281,"Aldi Stores Limited","Aldi Stores Ltd, 2 Birmingham Road, Studley, B80 7BG"
-0.474232,51.739268,Aldi,"London Road, Hemel Hempstead, Herts, HP3 9AA"
-0.446166,51.772152,"Aldi Stores Ltd","Cupid Green, Redbourn Road, Hemel Hempstead, HP2 7BA"
-2.395931,53.86359,Aldi,"Whalley Road, Clitheroe, Lancashire, BB7 1HT"
-1.47158,52.436845,"Aldi Stores Ltd","31 Roseberry Avenue, Coventry, CV2 1NB"
-1.435219,52.430941,"Aldi Stores Ltd","Aldi Supermarket, Hinckley Road, Coventry, CV2 2HP"
-1.520413,52.422336,"Aldi Stores Ltd","Aldi Supermarket, Radford Road, Coventry, CV6 3BU"
-1.168424,53.537037,Aldi,"Barnsley Road, Scawsby, Doncaster, DN5 8QE"
-0.806746,53.080873,Aldi,"Aldi Stores Ltd, North Gate, Newark On Trent, Nottinghamshire, NG24 1HD"
-3.317838,57.649935,"Aldi Stores Limited","11 Trinity Place Elgin Moray, IV30 1UL"
-2.998528,51.1289,"Aldi Stores Ltd","50-54 Eastover, Bridgwater, TA6 5AR"
1.07235,51.275615,Aldi,"Aldi, St Andrews Close, Canterbury,"
-3.563708,54.642248,Aldi,"Aldi Foodstore Ltd, Derwent Drive, Workington, Cumbria, CA14 3YW"
-3.375343,54.663139,Aldi,"Low Road, Cockermouth, Cumbria, CA13 0HH"
-2.895651,56.644105,"Aldi Store","Craig O'loch Road, Forfar, DD8 1BT"
-1.771724,51.561201,"Aldi Stores Ltd","Drove Road, Swindon, SN1 3AH"
-1.784158,51.603996,"Aldi Stores Ltd","Latham Road, Abbey Meads, Swindon, SN25 4DL"
-1.738738,51.595587,"Aldi Stores Ltd","Unit G, Pigeon House Lane, Stratton St Margaret, Swindon, SN3 4FN"
-0.279958,51.585212,Aldi,"634-640 Kingsbury Road, London, NW9 9HN"
1.108788,52.375184,"Aldi Stores Limited","37 - 38 Mere Street, Diss, Norfolk, IP22 4AG"
-1.30847,50.746138,"Aldi Stores Limited","Aldi, Newport Road, Cowes, PO31 8PF"
-1.074409,53.943368,ALDI,"Fulford Road, York, YO10 4PA"
-1.050904,53.984898,ALDI,"Kathryn Avenue, Huntington, York, YO32 9JS"
-2.929372,56.47356,Aldi,"140B Arbroath Road, Dundee, DD4 7PU"
-3.007199,56.474309,Aldi,"Harefield Road, Dundee, DD2 3XN"
1.421856,51.337801,"Aldi Store Limited","Boundary Road, Ramsgate, Kent, CT11 7NA"
1.388738,51.391251,"Aldi Store Ltd","Zion Place, Margate, Kent, CT9 1RP"
-2.191705,53.025635,"Aldi Stores Limited","Aldi Store, Stafford Road, Stone, ST15 0UN"
-2.194188,53.400717,Aldi,"220 Stockport Road, Cheadle Heath, Stockport, SK3 0LX"
-2.12373,53.397278,Aldi,"Lisburne Lane, Offerton, Stockport, SK2 5RH"
-2.150399,53.411378,ALDI,"Newbridge Lane, Stockport, SK1 2NA"
-2.182586,53.434316,ALDI,"Weybrook Road, Heaton Chapel, Stockport, M19 2QD"
-2.144413,53.362493,"Aldi Stores Ltd","Commercial Road, Hazel Grove, Stockport, SK7 4BE"
-4.13007,50.375396,Aldi,"Longfield Place, Plymouth, PL4 7JG"
-4.154412,50.369416,"Aldi Stores Limited","141 Union Street, Plymouth, PL1 3HF"
-1.430878,54.988888,Aldi,"Chichester Road, South Shields, Tyne & Wear, NE33 4HF"
-1.145248,52.643687,Aldi,"55 Woodgate, Leicester, LE3 5GH"
-1.149405,52.607668,Aldi,"Adelaide Works, 577 Aylestone Road, Leicester, LE2 8TD"
-1.120488,52.635847,Aldi,"Unit 5, St Georges Retail Park, St Georges Way, Leicester, LE1 1SG"
-1.395252,50.917974,"Aldi Stores Ltd","88 - 96 Bevois Valley Road, Southampton, SO14 0JZ"
-0.068153,51.595855,"Aldi Store","Supermarket, 570-592 High Road, Tottenham, London, N17 9TA"
-0.157899,52.786187,"Aldi Stores Limited","St. Thomas Road, Spalding, Lincs, PE11 2XY"
-1.374867,53.084717,"Aldi Store","Nottingham Road Somercotes Alfreton Derbyshire, DE55 4JN"
-1.359082,53.015605,"Aldi Stores","High Street Heanor Derbyshire D, DE75 7EX"
-2.216223,52.194577,Aldi,"Pheasant Street, Worcester, WR1 2DZ"
-2.230978,52.190656,Aldi,"Tybridge Street Retail Park, Tybridge Street, Worcester, WR2 5BA"
-1.721076,54.375139,"Aldi Stores Limited","Aldi, Richmond Road, Hipswell, Catterick Garrison, DL9 3JA"
-2.999285,51.59537,"Aldi Stores Limited","Aldi Stores Ltd Unit B Discovery Park Barrack Hill Newport South Wales, NP20 5GN"
-2.952738,51.575194,"Aldi Stores Limited","Aldi Stores Nash Road Newport South Wales, NP19 4TF"
0.469299,50.842806,Aldi,"57-69 London Road, Bexhill, East Sussex, TN39 3JY"
0.522567,51.614249,Aldi,"The Broadway, Wickford, Essex, SS11 7AJ"
0.505725,51.564166,"Aldi Stores Limited","Unit C1, High Road, Pitsea, Basildon, SS13 3BY"
-0.518654,51.887021,"Aldi Stores","Church Street, Dunstable, Bedfordshire, LU5 4RP"
-3.207962,50.794589,"Aldi Stores Ltd","Aldi, Exeter Road, Honiton, EX14 1AZ"
-0.017956,51.448339,"Aldi Stores","42-52 Rushey Green, London, SE6 4JD"
-1.543562,54.953938,Aldi,"Shields Road, Heworth, Gateshead, NE10 0QD"
-1.677908,54.961844,Aldi,"Gibside Way, Metrocentre, Gateshead, NE11 9XS"
-0.011879,51.109816,Aldi,"Aldi Stores Ltd 207 London Road East Grinstead West Sussex, RH19 5DF"
-3.033074,53.751224,"Aldi Supermarkets","353 Clifton Drive North, Lytham St Annes, FY8 2NA"
-1.687643,52.633718,Aldi,"Aldi Stores, Saxon Drive, Tamworth, B79 7HY"
-2.80305,56.329927,Aldi,"Tom Stewart Lane St Andrews Fife, KY16 8YB"
-3.16974,56.11336,"Aldi Stores","Aldi Ferrard Road Kirkcaldy Fife, KY2 5RY"
-3.010268,56.313513,"Aldi Stores Limited","Aldi Stores Ltd South Road Cupar Fife, KY15 5JF"
-3.34889,56.111433,"Aldi Stores Ltd","167 Stenhouse Street Cowdenbeath Fife, KY4 9DG"
-3.44443,56.074483,"Aldi Stores Ltd","18 Halbeath Road Dunfermline Fife, KY12 7QX"
-3.142529,56.127434,"Aldi Stores Ltd","20 Mckenzie Street Kirkcaldy Fife, KY1 2DJ"
-3.401808,56.062143,"Aldi Stores Ltd","Aldi Foodstore Ltd Nightingale Place Dunfermline Fife, KY11 8LW"
-3.025454,56.197277,"Aldi Stores Ltd","Turpie Road Leven Fife, KY8 4FB"
-2.620752,53.661311,"Aldi Foodstore Ltd","Aldi Foodstore, Harpers Lane, Chorley, PR6 0HU"
-1.372401,53.433232,Aldi,"Park Street, Masbrough, Rotherham, S61 1RL"
-1.346126,53.436803,Aldi,"126 Fitzwilliam Road, Eastwood, Rotherham, S65 1PX"
-1.212869,53.367901,Aldi,"Littlefield Road, Dinnington, Sheffield, S25 2NE"
-1.35113,53.509539,Aldi,"Colliery Avenue, Wath upon Dearne, Rotherham, S63 7EX"
0.55078,51.385951,"Aldi Stores","70 Duncan Road, Gillingham, Kent, ME7 4JS"
0.496247,51.395966,"Aldi Stores Ltd","Aldi, Friary Place, Strood, ME2 4WR"
-1.145054,52.957788,"Aldi Stores Ltd","157 Huntingdon Street, Nottingham, NG1 3NL"
-1.130073,52.981052,"Aldi Stores Ltd","565 Woodborough Road, Nottingham, NG3 5GG"
-1.169683,52.979178,"Aldi Stores Ltd","Lortas Road, Nottingham, NG5 1EL"
-1.205943,53.000667,"Aldi Stores Ltd","Aldi, Sellers Wood Drive, Nottingham, NG6 8GN"
-1.180525,52.963494,"Aldi Stores Ltd","Aldi, Radford Boulevard, Nottingham, NG7 5QS"
-1.474651,52.480433,Aldi,"Mill Street, Bedworth, CV12 8JX"
-1.513404,52.52198,Aldi,"Aldi Foodstore Ltd, Kingswood Road, Nuneaton, CV10 8QY"
-0.794343,52.00415,Aldi,"22B Barnsdale Drive, Westcroft, Milton Keynes, MK4 4DD"
-0.776079,52.043011,"Aldi Stores","1 Bradwell Common Boulevard, Bradwell Common, Milton Keynes, MK13 8BF"
-0.634762,52.902239,"Aldi Stores Ltd","Aldi, South Parade, Grantham, Lincolnshire, NG31 6HT"
-2.16113,51.98479,"Aldi Stores Limited","Gloucester Road, Tewkesbury, Gloucestershire, GL20 5SY"
-0.204729,51.905571,"ALDI Stores Ltd","Aldi Stores, Fairlands Way, Stevenage, Herts, SG1 1FZ"
-4.135731,52.928005,"Aldi Stores Ltd","Aldi, Ffordd Penamser, Porthmadog, Gwynedd, LL49 9NY"
-4.125568,53.229729,"Aldi Stores Ltd","Aldi Foodstore Ltd, Ffordd Garth, Bangor, Gwynedd, LL57 2RW"
-1.197801,53.133519,Aldi,"Nottingham Road, Mansfield, Nottinghamshire, NG18 4AF"
1.083555,51.071254,"Aldi Stores Ltd","72 High Street, Hythe, Kent, CT21 5AL"
-2.722574,53.36586,Aldi,"Lugsdale Road, Widnes, Cheshire, WA8 6UF"
-2.699983,53.326192,Aldi,"Unit 6 Trident Retail Park, Halton Lea, Runcorn, WA7 2FQ"
-2.085371,53.452303,"Aldi Stores","Aldi, Great Norbury Street, Hyde, Tameside, SK14 1BW"
-2.099313,53.489999,"Aldi Stores","Aldi Stores Ltd, 109 Wellington Road, Ashton-Under-Lyne, Tameside, OL6 7FN"
-2.060145,53.481118,"Aldi Stores","Leech Street, Leech Street, Stalybridge, Tameside, SK15 1SD"
-0.547093,51.257287,"Aldi Stores Limited","93 London Road, Guildford, Surrey, GU1 1YT"
-1.067808,54.595684,Aldi,"West Dyke Road, Redcar, TS10 4PS"
0.219012,51.445144,Aldi,"Aldi Stores, Unit 13, Orchards, High Street, DA1 1DN"
-0.473295,51.91686,"Aldi Stores Limited","Scott Road, Luton, LU3 3BF"
-0.428569,51.881006,"Aldi Stores Limited","Laporte Retail Park, Dallow Road, Luton, LU1 1NJ"
-0.270205,53.757134,"Aldi Stores Ltd","249 Preston Road, Hull, HU9 5AJ"
-0.350279,53.756456,"Aldi Stores Ltd","Beverley Road, Hull, HU3 1TY"
-0.402315,53.729992,"Aldi Stores Ltd","Priory Way, Hull, HU4 7BD"
1.240327,52.637554,Aldi,"1 Larkman Lane, Norwich, NR5 8TZ"
1.327087,52.63655,Aldi,"174 - 178 Plumstead Road, Norwich, NR1 4JZ"
1.308205,52.649797,Aldi,"463 Sprowston Road, Norwich, NR3 4EB"
-0.05866,51.408867,Aldi,"97 Croydon Road, Penge, London, SE20 7SX"
-2.124752,52.566846,"Aldi Stores Ltd","Aldi, Goldthorn Hill, Wolverhampton, West Midlands, WV2 3HP"
-2.128969,52.610936,"Aldi Stores Ltd","Aldi Stores, Mercury Drive, Wolverhampton, WV10 6DG"
-2.090292,52.596922,"Aldi Stores Ltd","Bentley Bridge Park, Bentleybridge Way, Wolverhampton, West Midlands, WV11 1BP"
0.687058,52.247844,Aldi,"Dettingen Way, Bury St Edmunds, Suffolk, IP33 3TU"
0.439966,52.083659,"Aldi Stores Limited","Aldi, Lordscroft Lane, Haverhill, Suffolk, CB9 0ER"
-2.172953,52.98167,Aldi,"Stanley Matthews Way, Stoke-on-Trent, ST4 8GR"
-2.160111,53.049017,Aldi,"Daisy Bank Road, Norton, Stoke-On-Trent, ST1 6AX"
-2.210751,53.054304,Aldi,"Brownhills Road, Tunstall, Stoke-On-Trent, ST6 4JU"
-2.090982,52.970704,Aldi,"Whittle Road, Meir, Stoke-On-Trent, ST3 7TU"
-3.146789,55.913058,Aldi,"376 Gilmerton Road, Edinburgh, EH17 7QS"
-0.406676,52.994416,"Aldi Stores Ltd","Mareham Lane, Sleaford, NG34 7JP"
-1.081558,50.812917,"Aldi Stores Ltd","1 Gamble Road, Portsmouth, PO2 7AL"
-1.760034,52.500127,"Aldi Stores Ltd","284 Chester Road, Solihull, Birmingham, West Midlands, B36 0LB"
-1.826749,52.410298,"Aldi Stores Ltd","240-244 Stratford Road, Shirley, Solihull, West Midlands, B90 3AE"
-2.59622,53.415376,"Aldi Stores Ltd","Winwick Road, Warrington, WA2 9SX"
-2.602554,53.389843,"Aldi Stores Ltd","Bankside, Crosfield Street, Warrington, WA1 1UP"
-2.52695,53.414147,"Aldi Stores Ltd","Birchwood Shopping Centre, Dewhurst Road, Warrington, WA3 7PG"
-2.581764,53.370423,"Aldi Stores Ltd","Church Farm Shopping Precinct, Walton Road, Warrington, WA4 6NJ"
-1.53274118900299,54.90010452270508,"ALDI FOODSTORES LTD.","WASHINGTON TOWN CENTRE, WASHINGTON, NE38 7RW"
-1.404462,54.903633,"ALDI STORES LIMITED","SAINT MARKS ROAD NORTH, SUNDERLAND, SR4 7DA"
-1.430719,54.918371,"ALDI STORES LIMITED","UNIT 4, TIMBER BEACH ROAD, SUNDERLAND, SR5 3XG"
-1.657928,54.991867,Aldi,"Aldi Stores Ltd, McKendrick Villas, Newcastle upon Tyne, NE5 3AB"
-1.689634,54.998836,Aldi,"Aldi Stores Ltd, Stamfordham Road, Westerhope, Newcastle upon Tyne, NE5 5HD"
-1.644114,55.012909,"Aldi Stores Ltd","Edgefield Avenue, Newcastle upon Tyne, NE3 3NB"
-2.204747,53.547948,"Aldi Stores Limited","Aldi, Kemp Street, Middleton, Rochdale, M24 4FH"
-2.167401,53.614699,"Aldi Stores Ltd","90 Mellor Street, Rochdale, OL12 6XD"
-2.23114991188049,53.44287872314453,"Aldi Stores Ltd","Aldi, Eastway, Middleton, Manchester, M24 5AS"
-2.171102,53.60282,"Aldi Stores Ltd","Aldi Foodstore Ltd, Edinburgh Way, Rochdale, Lancashire, OL11 2PD"
-2.210371,53.59235,"Aldi Stores Ltd","Aldi Stores Ltd, Bradshaw Street, Heywood, Lancashire, OL10 1PN"
-2.149518,53.61839,"Aldi Stores Ltd","Aldi Stores Ltd, Entwisle Road, Rochdale, Lancashire, OL16 2HZ"
-1.409874,52.53361,Aldi,"Watling Street, Hinckley, Leicestershire, LE10 3ED"
-3.015105,51.8195,Aldi,"Mill Street, Abergavenny, Monmouthshire, NP7 5HF"
-1.426911,53.251123,"Aldi Foodstore","Lockoford Road, Chesterfield, Derbyshire, S41 7EW"
-3.063856,53.292453,Aldi,"Aldi Foodstore Ltd, Ladies Walk, Neston, CH64 3RG"
-2.863421,53.193431,Aldi,"Unit 1, Bridge Works, Tarvin Road, Chester, CH3 5NA"
-2.897116,53.278785,"Aldi Stores","Aldi Foodstore Ltd, Grange Road, Ellesmere Port, CH65 0AR"
-2.90989,53.196663,"Aldi Stores Ltd","1-3 Bumpers Lane And, 2-4 Hartford Way, Sealand Industrial Trading Estate, Chester, CH1 4RY"
-2.504397,53.263944,"Aldi Stores Ltd","27 Leicester Street, Northwich, Cheshire, CW9 5LH"
-2.531272,53.190891,"Aldi Stores Ltd","Aldi Foodstore Ltd, Dene Drive, Winsford, CW7 1AT"
-2.146053,52.455158,Aldi,"New Road, Stourbridge, DY8 1PB"
-2.050646,52.451542,"Aldi Halesowen","Earlsway, Halesowen, B63 3HR"
-2.074878,52.484415,"Aldi Stores Limited","Aldi Stores Ltd, Saltwells Road, Netherton, Dudley, DY2 9PE"
-2.10253,52.49564,"Aldi Stores Ltd","Peartree Lane, Netherton, Dudley, DY2 0UW"
-1.872226,53.727263,"Aldi Foodstores","Unit 1, Crossley Retail Park, Pellon Lane, Halifax, HX1 5RA"
-1.835121,53.681333,"Aldi Stores Ltd","South Lane, Elland, HX5 0HQ"
-1.245006,54.689601,Aldi,"Dunston Road, Hartlepool, TS26 0EN"
-1.20999,54.665751,Aldi,"Teesbay Retail Park, Brenda Road, Hartlepool, TS25 1XJ"
-2.706437,53.759123,"Aldi Stores Ltd","Corporation Street, Preston, Lancashire, PR1 2UZ"
-2.676764,53.773936,"Aldi Stores Ltd","Deepdale Retail Park, Blackpool Road, Preston, PR1 6QY"
-2.687794,53.759995,"Aldi Stores Ltd","Unit 5, Queens Retail Park, Queen Street, Preston, PR1 4HZ"
-2.494883,51.438371,"Aldi Stores Ltd","106 Bath Road, Longwell Green, South Gloucestershire, BS30 9DE"
-2.556853,51.540399,"Aldi Stores Ltd","Aldi Foodstore Ltd, Ferndene, Bradley Stoke, South Gloucestershire, BS32 9DF"
-2.524361,51.607544,"Aldi Stores Ltd","St Marys Centre, Horseshoe Lane, Thornbury, Bristol, South Gloucestershire, BS35 2AZ"
-2.246241,53.792465,"Aldi Stores Ltd","Active Way, Burnley, BB11 1BS"
-3.818761,56.005721,"Aldi Foodstore Ltd","Redbrae Road, Falkirk, FK1 4DD"
-3.70795,55.991176,"Aldi Stores Ltd","The Co-Op, Greenpark Drive, Polmont, FK2 0PZ"
-2.394173,53.78647,"Aldi Stores Limited","1 Heys Lane, Great Harwood, BB6 7UA"
-2.367619,53.756103,"Aldi Stores Limited","Argyle Street, Accrington, BB5 1DA"
-1.597569,51.758289,Aldi,"Aldi Foodstore, Alvescot Road, Carterton, Oxfordshire, OX18 3JH"
-0.770285,53.387427,"Aldi Stores Ltd","Aldi Foodstore Ltd, Lea Road, Gainsborough, Lincolnshire, DN21 1AF"
-1.514945,52.91257,"Aldi Foodstore Ltd","Southmead Way, Mickleover, Derby, DE22 3HN"
-1.408207,52.91455,"Aldi Store","Aldi Supermarket, Nottingham Road, Derby, DE21 7NF"
-1.227708,52.359922,"Aldi Stores","12 Paddox Close, Rugby, CV22 5AU"
-1.24435,52.401889,"Aldi Stores Ltd","Central Park Drive, Rugby, CV23 0WE"
-2.492748,53.74982,Aldi,"Montague Street, Blackburn, BB2 1EH"
-2.492045,53.72862,"Aldi Store","Aldi Foodstore Ltd, Livesey Branch Road, Livesey, BB2 4LQ"
-2.718775,53.422225,Aldi,"Clock Face Shopping Parade, Clock Face Road, Clock Face, WA9 4LE"
-2.667719,53.466467,"Aldi Stores Ltd","8 Branchway, Haydock, St Helens, Merseyside, WA11 0QW"
-2.727677,53.450018,"Aldi Stores Ltd","St Helens Retail Park, St Helens, WA9 1JJ"
-3.191064,51.661494,Aldi,"Unit 1, Blackwood Gate Retail Park, Blackwood, NP12 2FS"
-3.214721,51.59082,Aldi,"Unit 12-13, Gallagher Retail Park, Parc Pontypandy, Caerphilly, CF83 3GX"
-3.22911,51.663342,"Aldi Stores Ltd","New Road, Tir-Y-Berth, Hengoed, CF82 8AU"
-3.09478,51.601163,"Aldi Stores Ltd","Pontymister Industrial Estate, Pontymister, Risca, NP11 6NP"
-1.244688,54.574565,Aldi,"106a Newport Road, Middlesbrough, TS1 5JF"
-1.21511,54.522252,Aldi,"Dalby Way, Middlesbrough, TS8 0TW"
-1.222515,54.559425,Aldi,"Marton Road, Middlesbrough, TS4 2PQ"
-0.176884,51.61324,"Aldi Store","350 Ballards Lane, London, N12 0DD"
-0.987349,50.853073,Aldi,"4 Park Way, Havant, PO9 1HH"
-0.26279,51.36664,Aldi,"379 - 393 Kingston Road, Ewell, Surrey, KT19 0BS"
-2.323794,53.425208,Aldi,"59 School Road, Sale, Cheshire, M33 7YF"
-2.276745,53.461316,"Aldi Foodstore Ltd","Aldi Foodstore Ltd, Seymour Grove, Old Trafford, Manchester, M16 0LH"
-2.357362,53.397652,"Aldi Stores Ltd","Davenport Road, Altrincham, Cheshire, WA14 5DT"
-2.354201,53.44984,"Aldi Stores Ltd","Eden Square, Golden Way, Manchester, M41 0NA"
-2.309435,53.445685,"Aldi Stores Ltd","Unit 5a Stretford Mall Extension, Stretford Shopping Mall, Chester Road, Stretford, Manchester, M32 9BA"
-0.228094,52.554583,"Aldi Stores Limited","Aldi Foodstore Ltd, Whittlesey Road, Stanground, Peterborough, PE2 8SQ"
-0.283572,52.590087,"Aldi Stores Limited","Aldi Superstore, Flaxland, Bretton, Peterborough, PE3 8DF"
-4.963742,51.802881,"Aldi Stores Ltd","Aldi Foodstore Salutation Square, Haverfordwest, Pembrokeshire, SA61 2LG"
-1.553735,54.008452,Aldi,"Unit 1, Harrogate Retail Park, Oak Beck Road, Harrogate, HG1 3HT"
-1.264069,53.27557,Aldi,"8 Mill Green Way, Clowne, Chesterfield, S43 4LJ"
-1.2167,53.203877,Aldi,"Aldi Stores Ltd, Carter Lane, Shirebrook, Mansfield, NG20 8PE"
-1.440956,53.546028,Aldi,"Aldi Foodstores Ltd, Hunningley Lane, Stairfoot, S70 3PE"
-1.478123,53.500866,"Aldi Stores Ltd","Aldi, Sheffield Road, Birdwell, S70 5TR"
-2.446544,53.087028,Aldi,"Nantwich Road, Crewe, CW2 6BP"
-2.370174,53.30235,Aldi,"Brook Street, Knutsford, WA16 8BW"
-2.433692,53.096326,Aldi,"11 Grand Junction Retail Park, Crewe, CW1 2RP"
-2.235839,53.165064,Aldi,"West Heath Shopping Centre, Holmes Chapel Road, Congleton, CW12 4NB"
-2.366949,53.144902,"Aldi Stores","Middlewich Road, Sandbach, CW11 1DH"
-2.125322,53.258707,"Aldi Stores","Aldi Food Stores Limited, Queen Victoria Street, Macclesfield, SK11 6LP"
-2.211506,53.165667,"Aldi Stores Ltd","Riverside, 0 Mountbatten Way, Congleton, CW12 1DL"
-2.669339,53.723033,Aldi,"Adjacent To Easthams Farm Cuerden Way Bamber Bridge Preston Lancashire, PR5 6BJ"
-2.700891,53.692031,Aldi,"Aldi Stores Westgate Leyland Preston Lancashire, PR25 2LX"
-0.167319,51.428395,"Aldi Stores Ltd","33-35 Tooting High Street, London, SW17 0SP"
-3.482498,50.736078,"Aldi Foodstore Ltd","Exhibition Way, Exeter, Devon, EX4 8JD"
-3.536602,50.713029,"Aldi Stores Ltd","Unit 2, Alphington Road, Exeter, Devon, EX2 8HP"
-1.880465,53.621957,Aldi,"9A Britannia Road, Slaithwaite, Huddersfield, HD7 5HE"
-1.633772,53.715015,Aldi,"Branch Road, Batley, WF17 5RY"
-1.831665,53.640585,Aldi,"Scar Lane, Milnsbridge, Huddersfield, HD3 4PE"
-1.732651,53.645942,"Aldi Unit 1","Gallagher Retail Park, Wakefield Road, Waterloo, Huddersfield, HD5 0BS"
-1.784387,53.654657,"Aldi Unit 4","Huddersfield Retail Park, Beck Road, Huddersfield, HD1 5DG"
-1.454289,52.750063,Aldi,"1 Dents Road, Ashby De La Zouch, Leicestershire, LE65 1JS"
-1.373951,52.730096,"Aldi Stores Ltd","Aldi Foodstore Ltd, Thornborough Road, Coalville, Leicestershire, LE67 3TH"
-1.824193,52.561433,Aldi,"101 Parade, Sutton Trinity, Birmingham, Birmingham, B72 1PL"
-1.873058,52.461348,Aldi,"273 Stratford Road, Sparkbrook, Birmingham, B11 1AD"
-1.858667,52.547419,Aldi,"30 Chester Road, Sutton Vesey, Birmingham, Birmingham, B73 5DA"
-1.886505,52.405623,Aldi,"Alcester Road South, Billesley, Birmingham, B14 5JE"
-1.792845,52.454987,Aldi,"New Coventry Road, Birmingham, B26 3HP"
-1.896919,52.497592,"Aldi Foodstore Ltd","1 Newtown Shopping Centre, Birmingham, B19 2SS"
-1.822915,52.479372,"Aldi Foodstore Ltd","199 Bordesley Green East, Bordesley Green, Birmingham, B9 5SP"
-1.874227,52.536775,"Aldi Foodstore Ltd","482-490 College Road, Kingstanding, Birmingham, B44 0HL"
-1.935928,52.444111,"Aldi Foodstore Ltd","Aldi, 637 Bristol Road, Selly Oak, Birmingham, B29 6AE"
-1.818853,52.446552,"Aldi Foodstore Ltd","Warwick Road, Acocks Green, Birmingham, B27 6RH"
-1.97205,52.413711,"Aldi Store Limited","Aldi, 860 Bristol Road South, Weoley, Birmingham, B31 2NS"
-2.774307,53.549885,"Aldi Stores Ltd","100 The Concourse, Southway, Skelmersdale, Lancashire, WN8 6LJ"
-2.887337,53.567715,"Aldi Stores Ltd","Unit 6, Two Saints Place, Ormskirk, Lancashire, L39 3RN"
-1.191736,52.614482,"Aldi Stores Ltd.","Meridian Way, Braunstone Town, Leicestershire, LE19 1LW"
-3.37925,52.241753,"Aldi Stores","Station Crescent, Llandrindod Wells, Powys, LD1 5BB"
-3.388435,51.945233,"Aldi Stores Ltd","Rich Way, The Watton, Brecon, Powys, LD3 7EH"
-3.026522,51.654642,"Aldi Stores Ltd","60 Woodside Road, Cwmbran, NP44 3EW"
-2.248036,52.382186,Aldi,"Green Street, Kidderminster, Worcestershire, DY10 1JF"
-2.734053,54.341744,"Aldi Stores Ltd","Aldi, Queen Katherines Avenue, Kendal, LA9 6DU"
0.110813,52.217539,Aldi,"Unit 1, 157 Histon Road, Cambridge, Cambridgeshire, CB4 3JD"
0.269694,52.398098,"Aldi Stores Ltd","41 Lisle Lane, Ely, Cambridgeshire, CB7 4AS"
-2.914742,53.468992,Aldi,"Copplehouse Lane, Field Lane Estate, Knowsley, L10 0AE"
-0.031648,52.97569,Aldi,"Queen Street, Boston, PE21 8XZ"
0.852052,51.889481,Aldi,"82 London Road, Colchester, CO3 9DW"
0.908989,51.88528,"Aldi Supermarket","Aldi Supermarket, Magdalen Street, Colchester, CO1 2FJ"
-1.103045,52.584105,"Aldi Foodstore Ltd","Bull Head Street, Wigston, Leicestershire, LE18 1PA"
-1.338787,51.075582,"Aldi Foodstore","Aldi Foodstore Ltd, 2 Burnett Close, Winchester, Hampshire, SO22 5JQ"
-0.689345,52.302979,"Aldi Stores Limited","Aldi Foodstore Ltd Ideal Retail Cou, 26 - 30 Victoria Road, Wellingborough, Northamptonshire, NN8 1HH"
-1.747676,53.00829,Aldi,"Carnation Way, Ashbourne, Derbyshire, DE6 1AY"
1.722553,52.611424,Aldi,"North Quay, Great Yarmouth, Norfolk, NR30 1JT"
0.113001,51.507949,"Aldi Stores Ltd","0 Central Way, London, SE28 8DT"
-1.907221,50.746027,"Aldi Stores Limited","262-268 Wallisdown Road, Bournemouth, BH10 4HZ"
-1.841988,50.727019,"Aldi Stores Limited","9-23 Palmerston Road, Bournemouth, BH1 4DB"
-1.85579,50.730858,"Aldi Stores Limited","257-263 Holdenhurst Road, Bournemouth, BH8 8NT"
0.31604,51.477288,"Aldi Gmbh & Co","Aldi, Unit A, 99 - 101 London Road, Grays, RM17 5YB"
-2.308751,53.500679,Aldi,"389 Bolton Road, Salford, M6 7NJ"
-2.337088,53.513348,"Aldi Stores Ltd","51 Swinton Hall Road, Swinton, M27 4BL"
-2.335158,53.484779,"Aldi Stores Ltd","Aldi, Church Street, Eccles, M30 0DF"
-4.190969,57.468995,"Aldi Stores Limited","Sir Walter Scott Drive, Inverness, Highland, IV2 3TW"
0.729204,52.042259,"Aldi Foodstore Ltd","Girling Street, SUDBURY, Suffolk, CO10 1NB"
-4.7647,55.953453,Aldi,"1 Patrick Street GREENOCK, PA16 8UT"
-1.32329,54.585671,Aldi,"Darlington Lane, Norton, TS20 1BW"
-1.344416,54.497633,Aldi,"9 Healaugh Park, Yarm, TS15 9XN"
-1.318678,54.55713,Aldi,"104 Yarm Lane, Stockton-On-Tees, TS18 1LQ"
0.145424,51.530616,"Aldi Stores Limited","Unit 1, Merrielands Retail Par, Merrielands Crescent, Dagenham, RM9 6SJ"
-1.163879,52.256908,"Aldi Stores","36-42 Sheaf Street, Town Centre, Daventry, Northamptonshire, NN11 4AB"
-1.187541,50.852435,"Aldi Stores Ltd","208 - 228 West Street, Fareham, PO16 0AL"
-0.915577,52.240224,"Aldi Stores","39 Harlestone Road, Duston, Northampton, NN5 7AE, NN5 7AE"
-0.846462,52.252228,"Aldi Stores","582-590 Wellingborough Road, Northampton, NN3 3JB, NN3 3JB"
-0.90195,52.255338,"Aldi Stores","Kingsthorpe Road, Northampton, NN2 6NJ, NN2 6NJ"
-0.4185,51.386624,Aldi,"20-32 Church Street, Walton-On-Thames, Surrey, KT12 2QS"
-0.972567,51.460661,Aldi,"Caversham Road, Reading, RG1 8AL"
-0.96929,51.432955,Aldi,"350 Basingstoke Road, Reading, RG2 0NT"
-1.526335,53.687458,"Aldi Stores","82 Batley Road, Wakefield, WF2 0AE"
-1.299127,53.694669,"Aldi Stores","South Baileygate, Pontefract, WF8 2LN"
-1.497002,53.649553,"Aldi Stores Limited","Asdale Road, Wakefield, WF2 7JE"
-1.357809,53.72385,"Aldi Stores Limited","Enterprise Way, Castleford, WF10 1EQ"
-3.785248,56.117757,"Aldi Stores Limited","Aldi, Whins Road, Alloa, Clackmannanshire, FK10 3SE"
-1.934191,52.760837,"Aldi Stores","Aldi Stores Ltd., Market Street, Rugeley, WS15 2JT"
-2.023872,52.68482,"Aldi Stores Ltd.","Aldi, Walsall Road, Cannock, WS11 0HJ"
-2.823358,55.623164,"Aldi Store","King Street Galashiels Scottish Borders, TD1 1PX"
0.526363,51.278952,"Aldi Stores Ltd","Wheeler Street, Maidstone, Kent, ME14 2FE"
-3.14561,51.492344,"Aldi Stores Ltd","City Link Retail Park, Newport Road, Cardiff, CF24 1PQ"
-3.23511,51.48185,"Aldi Stores Ltd","Aldi Foodstore Ltd, Cowbridge Road West, Caerau, Cardiff,, CF5 5BQ"
-3.068014,55.942188,"Aldi Stores Ltd","Aldi Stores Ltd, 1 Olivebank Retail Park, Newhailes Road, Newhailes, Musselburgh, East Lothian, EH21 6RE"
-2.706621,56.052367,"Aldi Stores Ltd","Aldi Stores Ltd, 48-52 Dunbar Road, North Berwick, East Lothian, EH39 5AB"
-2.939051,55.942267,"Aldi Stores Ltd","Aldi Stores Ltd, Haddington Road, Tranent, East Lothian, EH33 1DZ"
-2.764779,55.954417,"Aldi Stores Ltd","Aldi Stores Ltd, Whittingehame Drive, Haddington, East Lothian, EH41 4AG"
-2.232203,53.418869,Aldi,"674 Wilmslow Road, Manchester, M20 2DN"
-2.176666,53.462387,Aldi,"Garratt Way, Manchester, M18 8HE"
-2.292113,53.397513,Aldi,"580 Altrincham Road, Manchester, M23 9SR"
-2.169165,53.48113,Aldi,"998 Ashton New Road, Manchester, M11 4PD"
-2.209025,53.426893,Aldi,"Aldi Burnage, Kingsway, Manchester, M19 1LJ"
-2.242814,53.482944,Aldi,"Store 2b Arndale Centre, Market Street, Manchester, M4 3AB"
-2.226108,53.481134,Aldi,"Urban Exchange, Great Ancoats Street, Manchester, M4 6DE"
0.104696,51.565382,"Aldi Stores Limited","700 High Road, Seven Kings, IG3 8RS"
0.083897,51.574378,"Aldi Stores Limited","Unit 1, 8 Horns Road, Barkingside, IG2 6BE"
-0.915973,52.475484,Aldi,"Aldi Stores, Springfield Street, Market Harborough, Leicestershire, LE16 8BD"
0.499614,51.744528,"Aldi Stores Limited","Aldi, 471 Springfield Road, Chelmsford, CM2 6AT"
-3.006177,53.056841,"Aldi Supermarket","Aldi Supermarket, Plas Coch Retail Park, Wrexham, LL11 2BA, LL11 2BA"
